{
  "$schema": "https://json-schema.org/draft/2020-12/schema",
  "$id": "https://blackflagworks.dev/schemas/neospc-composition-plan.json",
  "title": "Neo-SPC composition plan",
  "type": "object",
  "required": [
    "id",
    "title",
    "category",
    "subcategory",
    "game_function",
    "emotional_thesis",
    "voice_profile",
    "voice_budget",
    "musical_identity",
    "voice_architecture",
    "form",
    "quality_gates"
  ],
  "properties": {
    "id": { "type": "string", "pattern": "^[a-z0-9_]+$" },
    "title": { "type": "string", "minLength": 1 },
    "category": { "type": "string" },
    "subcategory": { "type": "string", "minLength": 1 },
    "game_function": { "type": "string", "minLength": 1 },
    "emotional_thesis": { "type": "string", "minLength": 1 },
    "voice_profile": {
      "enum": ["legacy_8", "compact_12", "expanded_16", "ensemble_24", "symphonic_32"]
    },
    "voice_budget": { "enum": [8, 12, 16, 24, 32] },
    "musical_identity": {
      "type": "object",
      "required": ["meter", "bpm", "key", "mode", "motif", "harmonic_language", "bass_behavior", "groove", "silence_budget", "loop_strategy"],
      "properties": {
        "meter": { "type": "string" },
        "bpm": { "type": "number", "minimum": 30, "maximum": 260 },
        "key": { "type": "string" },
        "mode": { "type": "string" },
        "motif": { "type": "string" },
        "harmonic_language": { "type": "string" },
        "bass_behavior": { "type": "string" },
        "groove": { "type": "string" },
        "silence_budget": { "type": "string" },
        "loop_strategy": { "type": "string" }
      },
      "additionalProperties": false
    },
    "voice_architecture": { "type": "object" },
    "form": {
      "type": "array",
      "minItems": 2,
      "items": {
        "type": "object",
        "required": ["name", "function", "bars"],
        "properties": {
          "name": { "type": "string" },
          "function": { "type": "string" },
          "bars": { "type": "integer", "minimum": 1 },
          "development": {
            "enum": ["repeat", "sequence", "extend", "contract", "fragment", "vary", "augment", "counterpoint", "new", "recap"]
          }
        },
        "additionalProperties": false
      }
    },
    "energy_curve": {
      "type": "object",
      "additionalProperties": { "type": "number", "minimum": 0, "maximum": 10 }
    },
    "arrangement_exemptions": {
      "type": "array",
      "items": { "enum": ["short_loop", "drone", "continuous_combat"] }
    },
    "subtraction_events": {
      "type": "array",
      "items": {
        "type": "object",
        "required": ["at", "what"],
        "properties": {
          "at": { "type": "string", "minLength": 1 },
          "what": { "type": "string", "minLength": 1 },
          "why": { "type": "string" }
        },
        "additionalProperties": false
      }
    },
    "roster": {
      "type": "array",
      "items": {
        "type": "object",
        "required": ["id", "role", "entry", "exit"],
        "properties": {
          "id": { "type": "string", "minLength": 1 },
          "role": { "type": "string", "minLength": 1 },
          "entry": { "type": "string", "minLength": 1 },
          "exit": { "type": "string", "minLength": 1 }
        },
        "additionalProperties": false
      }
    },
    "arrangement_hook": {
      "type": "object",
      "required": ["what"],
      "properties": {
        "what": { "type": "string", "minLength": 1 },
        "register": { "type": "string" }
      },
      "additionalProperties": false
    },
    "quality_gates": {
      "type": "object",
      "additionalProperties": { "type": "boolean" }
    }
  },
  "additionalProperties": false
}
